{
  "version": "1.0",
  "plugin": "investment-banking",
  "routing_policy": {
    "invocation_policy_reference": "references/invocation-policy.md",
    "activation_gate": "Activate for explicit Investment Banking invocation or banker-owned transaction, capital markets, valuation, diligence, buyer/investor targeting, pitch, process, restructuring, coverage, sponsor, issuer, lender, or deal-advisory context. VDR, Datasite, data-room, CIM, teaser, buyer universe, outreach wave, NDA tracker, bid log, board transaction package, deal committee, ECM/DCM/LevFin, restructuring, and recovery language are high-signal when tied to banker workflow context.",
    "playbook_reference": "references/plugin-routing-playbook.md",
    "default_routing_principle": "Route broad prompts by banker transaction workflow before choosing an individual skill. Pick the lead skill that owns the first real judgment or artifact, then call support skills only when their lane owns a necessary workstream.",
    "artifact_hierarchy": "Hero human deliverable first, companion artifacts second, support JSON/CSV/Markdown/log/handoff files last.",
    "handoff_validation": "Validate every schema-backed cross-skill handoff before a downstream skill imports it, using scripts/validate_handoff_payload.py.",
    "support_artifact_policy": "Handoff JSON, manifests, logs, CSV ledgers, Markdown notes, and raw extraction files are support or agent artifacts unless the user explicitly requests machine-readable output."
  },
  "workflows": [
    {
      "workflow_id": "sell_side_auction",
      "workflow_name": "Sell-side auction",
      "banker_intent": "Run or prepare a sale process with source-backed materials, buyer targeting, process tracking, diligence gating, and final circulation QC.",
      "typical_user_prompts": [
        "Prepare the sell-side process package for this target.",
        "Build the buyer list, CIM story, first-wave diligence asks, and tracker for an auction.",
        "Analyze this Datasite/VDR export and identify diligence gaps before launch.",
        "We are launching a sale process; what should the team do first?"
      ],
      "lead_skill": "cim-teardown",
      "supporting_skills": [
        "financials-normalizer",
        "buyer-investor-list",
        "deal-process-tracker",
        "cim-builder",
        "pitch-deck-builder",
        "memo-builder",
        "ib-deck-qc",
        "financial-source-of-truth"
      ],
      "handoff_contracts": [
        {
          "contract_name": "cim_teardown_to_memo_builder",
          "producer_skill": "cim-teardown",
          "consumer_skill": "memo-builder",
          "required_when": "A process, diligence, IC, client, or MD memo will reuse CIM claims, red flags, seller asks, or source posture."
        },
        {
          "contract_name": "cim_builder_to_ib_deck_qc",
          "producer_skill": "cim-builder",
          "consumer_skill": "ib-deck-qc",
          "required_when": "A CIM, lender presentation, management presentation, or buyer-facing package is ready for circulation QC."
        },
        {
          "contract_name": "buyer_investor_list_to_deal_process_tracker",
          "producer_skill": "buyer-investor-list",
          "consumer_skill": "deal-process-tracker",
          "required_when": "A ranked buyer universe is converted into an outreach or process tracker."
        }
      ],
      "default_artifact_mode": "hybrid",
      "hero_deliverable": "HTML auction readiness report or CIM teardown report; XLSX buyer/process tracker when the user asks for execution tracking.",
      "companion_deliverables": [
        "buyer_investor_universe.xlsx",
        "deal_process_tracker.xlsx",
        "CIM/deck page plan or native deck when tooling is available",
        "ib_deck_qc_report.html before final circulation"
      ],
      "support_artifacts": [
        "handoffs/*.json",
        "support/source_index.csv",
        "support/claims_ledger.csv",
        "logs/manifest.json"
      ],
      "source_gates": [
        "Identify the controlling source packet, version, date, and seller perimeter before using claims.",
        "Classify VDR, Datasite, data-room, CIM, teaser, and management-presentation materials before routing claims into diligence, tracker, model, or buyer-facing work.",
        "Normalize financials and KPI schedules before model, CIM, or buyer-facing use.",
        "Keep seller claims distinct from verified facts, banker judgment, and assumptions.",
        "Preserve stable C-, Q-, RF-, source, and task identifiers across teardown, CIM, tracker, and QC artifacts."
      ],
      "quality_gates": [
        "No buyer-facing package may bypass ib-deck-qc when the posture is client-ready or final-circulation-candidate.",
        "No raw buyer CSV, claims JSON, or Markdown teardown may be the hero deliverable by default.",
        "Open evidence gaps, conflict posture, and owner/date next actions must be visible in the hero artifact."
      ],
      "routing_triggers": [
        "sell-side",
        "auction",
        "buyer list",
        "buyer universe",
        "CIM launch",
        "CIM teardown",
        "teaser",
        "VDR",
        "Datasite",
        "data room",
        "first-round bids",
        "NDA process",
        "NDA tracker",
        "outreach wave",
        "bid log",
        "process tracker",
        "sale process"
      ],
      "do_not_route_when": [
        "The request is only to clean a spreadsheet with no deal-process context.",
        "The user asks for legal advice on confidentiality, exclusivity, or definitive agreements.",
        "The user asks for a public-equity investment recommendation rather than transaction execution."
      ],
      "escalation_paths": [
        {"to": "Legal", "when": "NDA, exclusivity, definitive agreement, fairness opinion, disclosure, or regulatory legal advice is requested."},
        {"to": "Private Markets", "when": "The request is sponsor diligence or IC work with no bank sell-side process artifact."},
        {"to": "Corporate Finance", "when": "The task is internal FP&A, budget, or CFO operating reporting rather than transaction execution."}
      ],
      "clarifying_questions": [
        "Is the team selling, buying, financing, or preparing committee materials?",
        "Is the first artifact a diligence readout, buyer list, process tracker, CIM/deck, or QC report?",
        "What circulation posture is expected: working draft, senior-review-ready, client-ready, or final-circulation-candidate?"
      ],
      "stop_or_escalate_when": [
        "Conflicting company perimeter or document versions would change the buyer story.",
        "Material facts lack source support for client-ready circulation.",
        "Legal, tax, accounting, or securities-law conclusions are requested."
      ]
    },
    {
      "workflow_id": "sponsor_buy_side",
      "workflow_name": "Sponsor buy-side",
      "banker_intent": "Evaluate a target from seller materials, build model and valuation workstreams, pressure-test financing capacity, and synthesize a sponsor-style decision view.",
      "typical_user_prompts": [
        "We are evaluating this CIM for a sponsor buy-side process.",
        "Review this data-room packet for a sponsor buy-side diligence readout.",
        "Build the buy-side diligence, LBO, comps, DCF, scenarios, and IC view.",
        "Should we pursue this asset and what breaks the thesis?"
      ],
      "lead_skill": "cim-teardown",
      "supporting_skills": [
        "financials-normalizer",
        "lbo-model-build",
        "comps-valuation",
        "dcf-model-builder",
        "scenario-sensitivity-generator",
        "memo-builder",
        "model-audit-tieout",
        "financial-source-of-truth"
      ],
      "handoff_contracts": [
        {
          "contract_name": "cim_teardown_to_model_builder",
          "producer_skill": "cim-teardown",
          "consumer_skill": "model builders",
          "required_when": "Seller claims, model inputs, KPIs, diligence flags, or source IDs are imported into LBO, DCF, three-statement, merger, or comps model work."
        },
        {
          "contract_name": "cim_teardown_to_memo_builder",
          "producer_skill": "cim-teardown",
          "consumer_skill": "memo-builder",
          "required_when": "Diligence findings are synthesized into an IC, pursuit, or committee memo."
        }
      ],
      "default_artifact_mode": "hybrid",
      "hero_deliverable": "Sponsor diligence HTML report when judgment-first; banker-readable LBO/model workbook when model-first, with standalone HTML underwriting summary only when specifically requested.",
      "companion_deliverables": [
        "lbo_model.xlsx",
        "valuation_sensitivity_pack.xlsx",
        "investment_memo.html",
        "model_audit_pack.xlsx"
      ],
      "support_artifacts": [
        "handoffs/cim_teardown_to_model_builder.json",
        "support/normalized_financials.csv",
        "support/source_conflicts.csv",
        "logs/model_citations.json"
      ],
      "source_gates": [
        "Classify VDR, Datasite, data-room, CIM, teaser, and management-presentation materials before importing seller claims into model or memo work.",
        "Never import seller metrics into a model without source, period, definition, and normalization notes.",
        "Tie model assumptions to source records, explicit assumptions, or diligence open items.",
        "Keep QoE, customer concentration, working-capital, debt-like items, and KPI definitions visible as gates."
      ],
      "quality_gates": [
        "Audit model outputs before calling the package committee-ready.",
        "Scenario and downside cases must explain what breaks first and what action follows.",
        "Do not collapse diligence findings into a generic investment memo without preserving C-, Q-, RF-, and source IDs."
      ],
      "routing_triggers": [
        "sponsor buy-side",
        "IC memo",